id;name;description;year;rating;complexity
115;I'm the Boss!;"The six Investor cards are shuffled and one is dealt face up to each player. Any Investor cards not dealt to the players are set aside for now. The Influence Card deck is shuffled and each player is dealt five cards face down. The player whose Investor is first in alphabetical order goes first. The player to the starting player&rsquo;s right places the Dollar marker on any space on the game board.&#10;&#10;Each space on the game board represents a potential deal which Investors have to approve the deal and the number of dividends to be paid to those investors.&#10;&#10;On one&rsquo;s turn, a player can open negotiations on the deal where the Dollar marker rests or roll the six-sided die. If the player rolls the die, the Dollar marker is advanced clockwise around the game board counting the available deals as spaces. Once the Dollar marker rests, the player may try to negotiate that deal or draw three Influence cards. If by drawing cards, the player&rsquo;s hand exceeds twelve the player chooses which cards to discard to the limit.&#10;&#10;Should a player choose to make the deal, the player negotiates with the player or players representing the Investors how to divide the money at stake. The amount is number of dividends written on the space multiplied by value of the shares written on the deal tile. Any or all of the players may use their Influence cards to affect the outcome of the deal:&#10;&#10;&bull;    Clan cards may act in place of Investors whether the Investors are in play or not.&#10;&bull;    Travel cards put Investors out of play for the negotiations. Some are specific for a given Investor; some are wild to be played on any Investor.&#10;&bull;    Recruitment cards can only be played in sets of three to steal another player&rsquo;s Investor and make it your own.&#10;&bull;    Boss cards give the player control of the negotiations.&#10;&bull;    Stop cards immediately stop the effects of Travel, Recruitment, and Boss Influence cards.&#10;&#10;The players are paid from the bank when a deal has been struck. The game board space is covered with the Deal tile (effectively closing the space from further game play), the Dollar marker is moved to the next open space, and play continues with next player.&#10;&#10;Once nine deals have been made, a die is rolled after each subsequent deal to determine whether the game ends (with the odds increasing each time). Victory goes to whoever has the biggest bankroll!&#10;&#10;--user description&#10;&#10;";1994;6.7725;1.9655
117;Ta Yü;"In Ta Y&uuml;, a game of connections, one side tries to extend from the starting tile in the center to reach the western and eastern edges of the board while the opposing side tries to reach the northern and southern edges.  On your turn you simply draw a tile and decide where to place it, extending the network of tiles already on the board.&#10;&#10;Several refinements make this simple proposition into an engrossing game.  First, each tile is 3x1 (to be played on a 19x19 board) and has exactly three outlets (potential connection points). Second, your score is not simply the number of spots you've reached on one edge added to the number of spots you've reached on the other, but is the product of those two numbers.  So you can't just concentrate on one side and ignore the other, because zero times anything is still zero.  Third, on each side of the board there are three special points which score double if reached, adding a dab of focus to the choices.&#10;&#10;Interestingly, you need to play both offense and defense and will often have to decide to which use to put a particular tile.&#10;&#10;";1999;6.94776;2.0662
119;Cosmolancer;"Auf Heller und Pfennig takes participants to a medieval marketplace. Each turn, players place tiles onto the grid board that modify (either positively or negatively) the amount of money to be made by the shops that share that tile's row or column. Three times the board is filled with tiles and shop money is earned, after which the player with the most money wins.&#10;&#10;In Kingdoms, the first English-language version of Auf Heller und Pfennig, players try to collect the most gold by establishing castles in the richest regions of the realm while avoiding hazards like dragons, swamps, and trolls. The 2011 edition includes detailed plastic castles, a streamlined rulebook, and the addition of a wizard tile &mdash; one that increases the rank of adjacent castles, multiplying their scores &mdash; previously available only at game conventions.&#10;&#10;As of 2024, Cosmolancer is the newest version of this design, with players taking the role of freelance photographers...in space! As in the other versions, the game lasts three rounds, and to start a round, each player draws a random tile and keeps it secret. On a turn, you either:&#10;&#10;&bull; Draw a tile and place it in an empty space on the 6x5 grid.&#10;&bull; Place the tile in your hand.&#10;&bull; Place one of your tokens, which are numbered 1-4, in an empty space.&#10;&#10;When all of the spaces are filled, you score each of your tokens, multiplying the number on the token by the sum of the tiles in its row and column, with some special tiles nullifying positive values or splitting a row into two segments. You retrieve all of your 1 tokens, but the others are now out of play. After three rounds, whoever has the highest score wins.&#10;&#10;";1994;6.67197;1.8361
121;Dune;"Set thousands of years in the future, Dune the board game is based on the Frank Herbert novels about an arid planet at the heart of the human space empire's political machinations.&#10;&#10;Designed by the creators at Eon of Cosmic Encounter fame, some contend that the game can best be described as Cosmic Encounter set within the Dune universe, but the two games bear little in common in the actual mechanisms or goals; they're just both set in space. Like Cosmic Encounter, it is a game that generates player interaction through negotiation and bluffing.&#10;&#10;Players each take the role of one of the factions attempting to control Dune. Each faction has special powers that overlook certain rules in the game. Each turn players move about the map attempting to pick up valuable spice while dealing with giant sandworms, deadly storms, and other players' military forces. A delicate political balance is formed amongst the factions to prevent any one side from becoming too strong. When a challenge is made in a territory, combat takes the form of hidden bids with additional treachery cards to further the uncertainty.&#10;&#10;The game concludes when one faction (or two allied factions) is able to control a certain number of strongholds on the planet.&#10;&#10;Note that the Descartes edition of Dune includes the Duel Expansion and Spice Harvest Expansion, the Landsraad variant from Avalon Hill's General magazine, and additional character disks not provided by AH.&#10;&#10;";1979;7.58602;3.4498
123;Green Thumb Cards;"In this card game players are competing gardeners, attempting to collect sets of various plants in order to put them into their stacks.  In the meantime their incomplete sets are vulnerable to various event cards and other players.  Players have a number of attack cards at their disposal which they can use to wreak havoc on opponents' gardens.  These cards range from bugs and pests to kids tromping through the garden, and even animals that chew up or pee all over the plants.&#10;&#10;";1996;7.31034;1.2
125;Money!;"Your goal in Money! is to trade currencies with the bank and other players so that you end up with more value than anyone else.&#10;&#10;Each player starts with a hand of six cards from a deck that contains cards in seven currencies ranging in value from 20-60, along with coins worth 10. Four cards from the deck are placed face up to its left and to its right.&#10;&#10;In a round, each player chooses a bid of one or more cards from their hand, then everyone reveals their bid simultaneously. Whoever bid the highest sum takes the four cards to the left or right of the deck or another player's bid, adds these cards to their hand, then places their bid next to the deck or in front of the player whose bid they took. (Alternatively, the player can return their bid to hand.) Then the next player with the highest bid resolves their bid similarly. Once all players have resolved their bids, draw cards from the deck to refill the lots to the left and right of the deck to four cards. When the deck runs out, play one final round, then score your cards in hand.&#10;&#10;If you have 200 or more in a single currency, score that many points. If you have less than 200 in a currency, subtract 100 from that amount but don't go below 0. If you have all three 20s or 30s in a currency, score 100 points in addition to whatever the currency itself scores for you. Sum these amounts, along with whatever coins you have in hand. Whoever has the highest score wins.&#10;&#10;";1999;6.54108;1.5616
127;Princess Ryan's Star Marines;"The evil Dar Yamaguchi has kidnapped Princess Ryan and now a third rate group of Star Marines is charged with finding her before she's put to death.  The players form a semi-cooperative team that must overcome a steady onslaught of deadly attacks.  When the Marines win a contest, the biggest contributor wins the right to rewards, which could help him determine the location of the captive Princess.  If the Marines get to the castle in time, the player who determines the correct location of the Princess is dubbed the victor.&#10;&#10;Re-implements:&#10;&#10;    Princess Ryan&#039;s Space Marines&#10;&#10;&#10;";1997;5.40045;2.44
133;Frischfleisch;"Each player in Frischfleish (Fresh Flesh) represents a unique group of individuals stranded on a desert island.  Although there is a rescue attempt in the works, it's still a month away.  In the meantime, the characters will have to live off the land or off of each other depending on how it goes.  Players attempt to guide the members of their group around the island, keeping them alive with the food they find in the desert.  However if their foraging is less than successful, finding some poor schmuck's meaty thigh is a viable substitute.&#10;&#10;";1999;6.13096;2.5455
135;Kontor;"Kontor is a two-player tile-laying game which can also be played by two teams of two players. The name means 'Trading House' and the players act as merchants vying for supremacy in late 17th century Amsterdam. By building trading houses at the canals you aim to control three major commodities (Spices, Tea and Wine) in each harbor area. During the game you expand by playing Land and Water cards in the large area of the harbor. By the end of the game points are awarded according to ownership of the largest commodity majorities in each harbor area.&#10;&#10;This game has many optional rules, scenarios, expansions and variations.  The game is intended to be played by the advanced rules.&#10;&#10; Expanded by: &#10;&#10;&#10;     Kontor: 3 & 4 player expansion&#10;     Kontor: Die Ereigniskarten&#10;     Kontor: Die Aktionstafeln&#10;     Kontor: Das Exportlager&#10;&#10;&#10;";1999;5.96071;2.1975
137;Pass the Bomb;"This frantic game is a wonderful exercise in word-summoning.  In it, players try to come up with a word that contains a certain sequence of letters before the ticking time-bomb in their hands explodes.  The bomb is an electronic timer with a variable time allotment, and a player is only allowed to pass the bomb to the next person when he comes up with a word that contains the needed letters.  While creative spelling of the words in question can be frowned upon, it's up to the guy next to you to determine your fate.&#10;&#10;Awards&#10;&#10;1996 &#195;&#133;rets Familiespil, Family Game of the Year Denmark&#10;&#10;";1994;5.82428;1.2872
139;Hoax;"The basic idea in Hoax is to pretend to be somebody you are not while working towards the goal of figuring out who other people are. Each player is assigned one of six different characters -- each with its own unique abilities -- but can pretend to be any character and use its corresponding powers.  Abilities are used to acquire 3 different types of goods, which can be spent to get clues to opponents' identities.  If the majority of the other players think you're pretending to be a character that you're not, you must either admit that you are not that character (and permanently lose the use of its power), or reveal that you are and win the game.&#10;&#10;Re-implemented as:&#10;&#10;    Die Erben von Hoax&#10;&#10;&#10;";1981;5.90022;1.3529
141;Andromeda;"Each player controls bases/stations (in the form of little wooden cubes) which they use to attempt to build Economic Centers on the moons of seven planets in an alien planetary system.  After moving their tokens on to a planet, players use an interesting little device ('planet ring'/'wormhole' - functions like a blind draw bag) to select one of the tokens on the planet.  Players take actions by collecting sets of cards which correspond to the the various planets.  The game also features a unique trading system which facilitates the card collecting. Careful card trading and calculating risk of establishing economic centers, and some variants, mitigate some of the luck factor.&#10;&#10;&#10;&#10;Game Summary&#10;Setup: 9 cards/player. Place 1 cube per planet per player, plus additional cube per planet matching cards dealt out; remaining cubes on earth. Each gets 2 special action cards.Each round: First, players may play a single special action card, in order. Then, Trade Step. Finally, Action Step.&#10;&#10;Trade Step: Start player first plays cards (2-3) to offer, one at a time; other players simultaneously show cards to trade, different than offered. Start player must trade; recipient either accepts cards into hand, or leaves out. Clockwise from Start Player, next player with cards still in front of them either makes a trade or takes their cards back. Continue till 0-1 people left with cards in front; they take them back to hand.&#10;&#10;Action Step: Start player takes 3 actions, then others take 2 each. Actions can be:&#10;- discard 2 cards, then draw 2&#10;- turn in set of 3-7 cards to send half (rounding down) as many cubes from earth to a planet&#10;- turn in set of 3-7 cards to advance Ship Level, Tech Level, or to make attempt to establish colony on a planet matching cards played: place cubes on that planet into the cosmic ashtray, randomize, then reveal up to as many cubes as attempts made. If reveal your cube, place it on a station; turn over. If other player's cube, send it back to earth.&#10;- Sets: if no wilds (&quot;pure&quot;), take appropriate bonus wild card matching the size of the set (if available); wilds can be used later as parts of sets&#10;&#10;Then rotate starting player to the left. Game ends when all stations on 3 planets have been taken. Score VP shown on board (for Tech level, stations occupied, and cubes on earth). Most VP wins.&#10;&#10;";1999;6.38595;2.2248
143;Wortelboer;"In this very unusual card game, players are given equal stacks of cards, which have either carrots, bunnies, or foxes pictured on them.  The idea is that players set the cards out in biological pyramids, with the carrots eaten by the bunnies and the bunnies eaten by the foxes.  However, there is nothing simple about this intriguing and mystifying little game.&#10;&#10;";1999;4.17647;1.0
145;Metropolis;"One of game designer Sid Sackson&#039;s greatest contributions to the negotiation genre, this game has players  trying to construct the best buildings in a rapidly growing city.  The map is a collection of city blocks broken into smaller properties.  Each turn, players choose one property and try to work out deal for placing a new structure on the board.  The value of each building is determined by the type of buildings in the same block, so both a school and an apartment building receive bonuses for existing together.&#10;&#10;";1984;6.36169;2.2353
147;Crude: The Oil Game;"In Crude: The Oil Game, players take on the role of oil company CEOs, seeking to expand their companies into multi-national energy mega-corporations.  Just as with real world energy companies, player will setup facilities for oil drilling, oil pumping, oil refining into gasoline, and gasoline selling to the consumer... all of which are represented by actual plastic pieces placed on the board!  Players also speculate by buying and selling oil and gasoline barrels in both the domestic and foreign markets... again represented by actual plastic barrels in their playing area!&#10;&#10;However, the changing economic climate, as well as sudden world news events, will challenge players to keep a long-term strategic view of the world energy markets.  The first player to reach a corporation value of $750 million is the winner!&#10;&#10;Crude: The Oil Game is not only a great simulation of the global oil markets, but with almost 300 plastic playing pieces, it is a sight to behold!  Known as McMulti when it was printed in Europe almost 25 years ago, this great game is finally back in print after many years!&#10;&#10;Brought back into print in 2012 by Stronghold Games, Crude: The Oil Game has been a highly sought-after (&quot;Grail&quot;) game. This is an early Euro-style game &ndash; before Euro-style existed! &ndash; which accurately simulates the market forces and elements of the oil and gasoline markets at all levels of production, including oil drilling, oil pumping, oil and gasoline buying and selling in the domestic and foreign markets, oil refining, and finally gasoline selling to the consumer.&#10;&#10;";1974;6.69238;2.7379
151;Piratenbillard;"This interesting dexterity game is played on a table-like board that is a wooden lattice with a piece of linen stretched over the bottom.  Little colored balls are placed in the resulting holes, and then players use long wooden mallets to strike the bottom of the table.  When a ball is hit correctly, it will pop out of the space it's in and land in another space closer to the opposite side of the board.  Landing on another player's ball lets you capture it, but if your ball lands off the board, it's out of the game.&#10;&#10;";1989;6.55146;1.2414
153;Take 5!;"Relying heavily on his previous effort, 6 Nimmt!, Wolfgang Kramer has transformed it into a more strategic game.  The deck is numbered from 1 to 98, with some of the cards having green bullheads and others having red bullheads.  In this game greens are positive points and reds are negative points.  As in 6 Nimmt!, players are constructing sets of cards, with the fifth card in a set taking the whole thing.  This time, however, players take their turns sequentially and can play one to three cards from their hands.&#10;&#10;In a confusing twist, the Dutch edition of 6 Nimmt! is called Take 5! but is the progenitor game, not this game.&#10;&#10;";1998;6.55984;1.474
155;Was sticht?;"This is a two-trump, trick-taking card game, with several twists.  At the beginning of the game, players draft tasks they intend to complete in order to win the game.  (Tasks include things like &quot;Take no tricks&quot;, &quot;Take 1 Trick&quot;, or &quot;Take No Red Cards&quot;.)  Then, all of the cards are dealt out in front of the players before each hand.  Row by row, the players draft cards, and the dealer declares who would have won each row's trick, if it had been played that way.  Players use this information to deduce what the trump number and suit are.  After all the cards are drafted, each player - except the dealer - selects one of the task tiles she drafted, which will be her mission for the hand.  The dealer is stuck trying to uniquely accomplish someone else's task for the round - but at least doesn't have to preselect which person's goal he is trying to &quot;steal&quot;.  The hand is then played in the traditional fashion, with each player trying to take tricks or not, based on the goal she selected.  The first player to complete five tasks wins the game.&#10;&#10;Re-implemented by:&#10;&#10;    M&#195;&#188; and Lots More&#10;&#10;&#10;";1993;6.98274;2.377
157;Eurorails;"Eurorails is another entry in the Mayfair Games crayon rail games, like Empire Builder and India Rails.  Its puzzle-piece board forms a map of Europe broken down into dots.  Players use different-colored crayons to draw rail from dot to dot, building their rail system.  A large deck of cards is used to determine how much money will be generated by picking up a particular commodity and delivering it to the listed city, with the payoffs being related to how far away the source is from the destination.  As players generate more money, they build successively larger and more comprehensive rail systems, hopefully connecting to almost all the major cities.  The goal of the game is to generate a set amount of money once you've linked all the major cities.&#10;&#10;";1990;7.09791;2.7432
162;The Awful Green Things From Outer Space;"This humorous, entertaining game pits two players against each other aboard a spaceship.  One plays the ship's crew, trying to kill the evil and rapidly multiplying aliens controlled by his opponent.  And although the crew members have several weapons available to them, they don't know what effect those weapons will have until they try using them in combat against the Awful Green Things. Originally appeared in the Dragon magazine #28.  The Outside the Znutar expansion, published in Dragon magazine #40, is included in the box in the Steve Jackson Games versions of the game.&#10;&#10;Similar but more serious titles are SPI's The Wreck of the B.S.M. Pandora or TFG's Intruder.&#10;&#10;Supplemental articles were published in TSR's Dragon Magazine including:&#10;&#10;&quot;The Awful Green Things From Outer Space&quot; Tom Wham - Issue 28 (page 26) &#10;Addenda &quot;Outside the Znutar&quot; Tom Wham - Issue 40 (insert)&#10;&#10;";1979;6.55028;1.8776
163;Balderdash;"A clever repackaging of the parlor game Dictionary, Balderdash contains several cards with real words nobody has heard of.  After one of those words has been read aloud, players try to come up with definitions that at least sound plausible, because points are later awarded for every opposing player who guessed that your definition was the correct one.&#10;&#10;Versions of the game as a parlor game go back at least as far as 1970, although Balderdash itself was not published until 1984.&#10;&#10;Mattel, Inc. republished Balderdash in 2006 in a form that derives its gameplay from the sequel Beyond Balderdash.&#10;&#10;Re-implemented by:&#10;&#10;    Beyond Balderdash / Absolute Balderdash&#10;    Kokkelimonke Jubileum&#10;&#10;&#10;Re-implements:&#10;&#10;    Beyond Balderdash*&#10;&#10;&#10;&#10;    In a peculiar situation, this game was reimplemented by Beyond/Absolute Balderdash and then combined back into the original title (Balderdash) but with the rules and cards from Beyond/Absolute; while Tactic re-published their version of Beyond/Absolute combined with the original Balderdash and called it Kokkelimonke Jubileum.&#10;&#10;&#10;";1984;6.4785;1.3977
164;Before I Kill You, Mister Spy...;"Before I Kill You, Mr. Bond is a silly, stupid game straight from the Cheapass Games playbook. In it, players take on the role of villains building their remote fortresses and capturing secret agents. When one is captured, he can be killed right away, but what's the fun in that? The real points come when you slowly reveal your secret plan to him &mdash; or leave him to be eaten by sharks. Of course, that's where the risk is, too, and the longer you postpone the kill, the greater the likelihood that another player will produce a card that allows the agent to escape and destroy your fortress.&#10;&#10;Reissued in color in 2004 as James Ernest's Totally Renamed Spy Game (with many more cards), then reissued again in 2016 as Before I Kill You, Mister Spy...&#10;&#10;";1996;5.43594;1.265
166;Black Death;"In this cheerfully demented offering, participants each play the part of a disease trying to inflict misery on the European populace.  Each disease has mortality (lethalness) and virulence (contagiousness) factors, and the key to causing maximum suffering is striking the right balance between the two.  It's no good being a fast-acting disease if your carriers all die before passing you on to the next city!&#10;&#10;";1993;5.74468;1.85
