id;name;description;year;rating;complexity
1;Die Macher;"Die Macher is a game about seven sequential political races in different regions of Germany. Players are in charge of national political parties, and must manage limited resources to help their party to victory. The winning party will have the most victory points after all the regional elections. There are four different ways of scoring victory points. First, each regional election can supply one to eighty victory points, depending on the size of the region and how well your party does in it. Second, if a party wins a regional election and has some media influence in the region, then the party will receive some media-control victory points. Third, each party has a national party membership which will grow as the game progresses and this will supply a fair number of victory points. Lastly, parties score some victory points if their party platform matches the national opinions at the end of the game.&#10;&#10;The 1986 edition featured four parties from the old West Germany and supported 3-4 players. The 1997 edition supports up to five players in the re-united Germany and updated several features of the rules as well.  The 2006 edition also supports up to five players and adds a shorter five-round variant and additional rules updates by the original designer.&#10;&#10;";1986;7.58934;4.3081
2;Dragonmaster;"Dragonmaster is a trick-taking card game based on an older game called Coup d'&#195;&#137;tat. Each player is given a supply of plastic gems, which represent points. Each player will get to be the dealer for five different hands, with slightly different goals for each hand. After all cards have been dealt out, the dealer decides which hand best suits his or her current cards, and the other players are penalized points (in the form of crystals) for taking certain tricks or cards. For instance, if &quot;first&quot; or &quot;last&quot; is called, then a player is penalized for taking the first or last tricks. All players will get a chance to be dealer for five hands, but other players can steal this opportunity by taking all of the tricks during certain hands. At the end, the biggest pile of gems wins the game.&#10;&#10;Jewel contents:&#10;&#10;10 clear (2 extra)&#10;14 green (2 extra)&#10;22 red (2 extra)&#10;22 blue (2 extra)&#10;&#10;";1981;6.65971;1.9643
3;Samurai;"Samurai is set in medieval Japan. Players compete to gain the favor of three factions: samurai, peasants, and priests, which are represented by helmet, rice paddy, and Buddha figures scattered about the board, which features the islands of Japan. The competition is waged through the use of hexagonal tiles, each of which help curry favor of one of the three factions &mdash; or all three at once! Players can make lightning-quick strikes with horseback ronin and ships or approach their conquests more methodically. As each figure (helmets, rice paddies, and Buddhas) is surrounded, it is awarded to the player who has gained the most favor with the corresponding group.&#10;&#10;Gameplay continues until all the symbols of one type have been removed from the board or four figures have been removed from play due to a tie for influence.&#10;&#10;At the end of the game, players compare captured symbols of each type, competing for majorities in each of the three types. Ties are not uncommon and are broken based on the number of other, &quot;non-majority&quot; symbols each player has collected.&#10;&#10;The game is part of what is sometimes called the Knizia tile-laying trilogy.&#10;&#10;";1998;7.47612;2.4423
4;Tal der Könige;"When you see the triangular box and the luxurious, large blocks of Tal der K&ouml;nige (German: &quot;Valley of the Kings&quot;), you can tell this game was designed to be beautiful as well as functional.  The object of the game is to build pyramids out of the different colored blocks.  A pyramid scores more points when it's made from a few colors, but it's much harder to consistently outbid the other players for the necessary blocks.  The game is over when the Pharoah's Pyramid in the center is completed, which is built using all the blocks that the players don't use during the course of the game.&#10;&#10;Final round 1990 Hippodice Spieleautorenwettbewerb.&#10;&#10;";1992;6.6154;2.6875
5;Acquire;"In Acquire, each player strategically invests in businesses, trying to retain a majority of stock.  As the businesses grow with tile placements, they also start merging, giving the majority stockholders of the acquired business sizable bonuses, which can then be used to reinvest into other chains.  All of the investors in the acquired company can then cash in their stocks for current value or trade them 2-for-1 for shares of the newer, larger business.  The game is a race to acquire the greatest wealth.&#10;&#10;History of Acquire: This Sid Sackson classic has taken many different forms over the years depending on the publisher, yet the rules and game play have stayed the same. The 1966 version of the 3M bookshelf edition included rules for a 2-player variant. The original version is part of the 3M Bookshelf Series.&#10;&#10;Many books and websites incorrectly list this as a 1962 publication as the 3M Company used previously copyrighted artwork when they released the game in 1964. 3M actually received the idea for the game of &quot;Vacations&quot; from Sid Sackson in May of 1963 and decided to take his idea and put it into artwork they had developed the year before for a game called &quot;ACQUIRE.&quot; 3M's original game idea for a game called ACQUIRE must not have been very good so they decided to take Sid's idea of Vacations and put it into their concept of ACQUIRE. They released some limited test market games in 8 Midwestern U.S. cities in December of 1963 with a box that had a 1963 copyright. These games had Sid's original rules. When 3M released the mass market games in 1964, they had developed some of Sid's original ideas and changed some rules and game play to match their production desires. They released them with outer boxes that were copyrighted 1962 and inner boxes with rules that were dated 1963.&#10;&#10;December 1963 - Test Market World Map Wood Tile Edition&#10;1964 - Dated 1962/63 wood tiles, chipboard with plastic overlay &amp; stocks with printed backs&#10;1965 - Dated 1962/63 plastic tiles, chipboard with plastic overlay &amp; stocks with printed backs (last edition made with printed backs until 1999)&#10;1966 - Dated 1962/66 plastic tiles, chipboard with plastic overlay &amp; non-wax coated stocks (Only edition with these stocks)&#10;1968 - Dated 1968/66 plastic tiles, clear plastic board with paper underlay (Both 1966 inner box games have a lot of mixed parts)&#10;1971 - Dated 1968/71 plastic tiles, yellow hard plastic board&#10;1975 - 3M sells rights for game of ACQUIRE to the Avalon Hill Company&#10;1976 - Dated 1976 plastic tiles, yellow hard plastic board, redesigned money, no inner box (This edition was also produced in 1977, 79, 81, 82,       &amp; 86)&#10;1989 - Dated 1976 Gray box edition with new box artwork same contents as regular 1976 editions (This edition was also produced in 1992)&#10;1995 - Dated 1995 Large box cardboard edition with chipboard board and tiles, Special Powers Variant Tiles inspired by German editions&#10;1997 - Avalon Hill sells the rights to the game of ACQUIRE to Hasbro&#10;1999 - Dated 1999 Large box with large plastic board and tiles, 3D company buildings, redesigned stocks &amp; money, large info cards&#10;2006 - Hasbro assigns rights for the game of ACQUIRE to their subsidiary, Wizards of the Coast&#10;2006 - Lloyd's (private) Rules of ACQUIRE are made public, two major rule changes that help to bring the balance of the game of ACQUIRE back to the  intentions of Sid Sackson's original ideas. Lloyd Solon's Rules help players to correct poor strategy during the beginning of the game that can been seen with new and unexperienced players (running out of money soon is the main mistake that must be omitted!).  &#10;2008 - Dated 2008 cardboard edition with chipboard board &amp; tiles, redesigned stocks &amp; money&#10;2016 - Dated 2016 The current affordable mass-market edition. It looks at first sight to be similar to previous modern editions, but has been criticised for the use of inferior design choices such as hard-to-read grey-on-grey embossed slots and the unusual tile fonts. It contains modified rules and a slightly smaller playing grid. Although these changes have been criticised for not ultimately improving upon Sackson's original design, they are generally regarded as not being too damaging to it.&#10;2023 - Renegade Game Studio partners with Hasbro, and releases their new version, with Classic Mode or Tycoon Mode &mdash; play with or without tertiary stockholder merger bonus. &#10;2024 - The Renegade 60th Anniversary edition includes a set of plastic weighted poker chips, and Special Powers Variant cards.&#10;&#10;";1964;7.35072;2.4923
6;Mare Mediterraneum;"In the ancient lands along the Mediterranean, players attempt to satisfy their unique victory conditions via trade, war and construction.  This lavishly produced game contains tons of wooden game components and a beautiful roll-out vinyl map.  Players produce a score of different commodities to trade with other cities in the hope of creating enough income to fill their capitals with buildings, produce artwork, and fill warehouses with goods.&#10;&#10;";1989;6.4523;3.0
7;Cathedral;"In Cathedral, each player has a set of pieces of a different color. The pieces are in the shapes of buildings, covering from one to five square units. The first player takes the single neutral Cathedral piece and places it onto the board. Players then alternate placing one of their buildings onto the board until neither player can place another building. Players capture territory by surrounding areas that are occupied by at most one opponent or neutral building. A captured piece is removed and captured territory becomes off-limits to the opponent. The player with the fewest 'square units' of buildings that can't be placed wins.&#10;&#10;";1979;6.54931;1.7887
8;Lords of Creation;"In this interesting offering from Warfrog, players become Gods seeking to dominate a world with their followers.  The first part of the game involves constructing the game board, after which players take turns using cards to determine how many new people should appear and what type of terrain they will inhabit.  All tribes start off as barbarians, but soon the calming effect of civilization settles the marauding bands; although civilized tribes score more, they can no longer attack.  What they can do, though, is civilize other players' followers.  Sure it gives opponents more points, but at least those followers won't come after you!&#10;&#10;";1993;6.05322;2.4
9;El Caballero;"Although referred to as a sequel to El Grande, El Caballero shares few aspects with its namesake, being a fun but intense brain-burner in which players explore and attempt to control the lands and waterways of the New World.&#10;&#10;The players are following Columbus by exploring the islands he discovered. Players slowly explore the islands &ndash; by picking and placing land tiles that are most favorable to them &ndash; and discover wealth in the form of gold and fish. As they learn about the land and sea areas of this new land, they position their caballeros to try to maintain control of the important regions. Castillos give them a measure of protection from others, and ships allow them to establish trade and to fish for food. Success is measured in the size of land and sea areas they control. Their success is measured twice, and in the end these scores are summed and the winner declared.&#10;&#10;";1998;6.47043;2.9515
10;Elfenland;"Elfenland is a redesign of the original White Wind game Elfenroads.  The game is set in the mythical world of the elves.  A group of fledgling elves (the players) are charged with visiting as many of the twenty Elfencities as they can over the course of 4 rounds.  To accomplish the task they will use various forms of transportation such as Giant Pigs, Elfcarts, Unicorns, Rafts, Magic Clouds, Trollwagons, and Dragons.&#10;&#10;Gameplay:  Players begin in the Elf capitol, draw one face down movement tile, and are dealt eight transport cards and a secret 'home' city card that they must reach at the end of the 4th round or lose points for each city space away from 'home' they are at the end of the game. Markers of each player's color are placed in each city on the board and are collected when the player visits that city (each counts as 1 point).&#10;  &#10;     The round proceeds in 2 stages.  The first part of the round consists of the drawing of Tiles showing the differing types of transport (except rafts) from a combination of face up and face down tiles (if a player doesn't like the 5 tiles that are face up; they can always draw blind from the face down tiles and hope to get one they need).  These transport tiles need to match the Transportation cards in your hand to use them most effectively.  After each player has a total of 4 tiles they take turns placing a tile on any one of the roads that run between the elf cities.  Only one transport tile may be placed on each road; so players may use other players tiles to travel if they have the matching cards in their hand.  This frequently causes a readjustment of planned travel routes as other players tiles can allow you to move farther or shorter than you had first thought.  Players can play their tiles to help themselves or hinder others by playing a slow mode of transport on another players (perceived) path.&#10;&#10;Each mode of transport has certain terrain it can travel through quickly or slowly, and those that it cannot. These are listed on the top of each transportation card by the number terrain symbols.  The number of terrain symbols equals how many matching cards you must play to move across a given tile in a given terrain.  For example, a Magic Cloud tile placed in a mountain would take one Magic cloud card to travel across (1 mountain symbol on card means Magic clouds are fast in mountains). If the same tile was placed on a road in forest terrain it would require 2 Magic Cloud cards to travel that route (2 Forest symbols on card means Magic Clouds are slow in Forest).  Magic Clouds cannot travel in desert terrain at all (no desert symbols on card). All modes of transport are different and Rafts can be used on rivers or lakes without needing tiles. Rafts go slow upstream (2 raft cards needed) and fast downstream (1 card needed).  The small lake requires 1 raft card to travel across and the larger lake requires 2 cards to travel across.  Players may keep one unused transport counter and up to 4 Transportation cards from one round to the next.&#10;&#10;The second part of the round begins after all players have finished placing their transportation tiles for the round.  Each player plays his cards and moves his elf-boot around the board collecting his tokens from the cities visited.  If there is a Transport tile on a route and a player has no matching Transportation card he may 'Caravan' across it by playing any 3 Transportation cards from his hand.&#10;&#10;As a bit of 'take that' each player has a trouble tile which can be placed next to any transportation tile during the first part of the round.  This counter means that in order to travel that path an additional card of the transport type must be played or 4 cards to 'Caravan'.&#10;&#10;Victory: if at the end of round 3 a player has visited all 20 cities he is the winner.  If not the game ends after round 4 when 'Home' cities are revealed and each player subtracts points for each city he is away from his 'home' subtracting that from his collected city tokens.  The person with the highest score wins.&#10;&#10;";1998;6.67173;2.1511
11;Bohnanza;"Bohnanza is the first in the Bohnanza family of games and has been published in several different editions, including a 2023 version with flowers.&#10;&#10;This entry lists a few different major card sets for Bohnanza: the base game for 3-5 players, the expanded game with the same name for 2-7 players (that is, first expansion included), and Bohnanza Pocket.&#10;&#10;In the game, you plant, then harvest bean cards in order to earn coins. Each player starts with a hand of random bean cards, and each card has a number on it corresponding to the number of that type of beans in the deck. Unlike in most other card games, you can't rearrange the order of cards in hand, so you must use them in the order that you've picked them up from the deck &mdash; unless you can trade them to other players, which is the heart of the game.&#10;&#10;On a turn, you must plant the first one or two cards in your hand into the &quot;fields&quot; in front of you. Each field can hold only one type of bean, so if you must plant a type of bean that's not in one of your fields, then you must harvest a field to make room for the new arrival. This usually isn't good! Next, you reveal two cards from the deck, and you can then trade these cards as well as any card in your hand for cards from other players. You can even make future promises for cards received right now! After all the trading is complete &mdash; and all trades on a turn must involve the active player &mdash; then you end your turn by drawing cards from the deck and placing them at the back of your hand.&#10;&#10;When you harvest beans, you receive coins based on the number of bean cards in that field and the &quot;beanometer&quot; for that particular type of bean. Flip over 1-4 cards from that field to transform them into coins, then place the remainder of the cards in the discard pile. When the deck runs out, shuffle the discards, playing through the deck two more times. At the end of the game, everyone can harvest their fields, then whoever has earned the most coins wins.&#10;&#10;The original German edition supports 3-5 players. The English version from Rio Grande Games comes with the first edition of the first German expansion included in a slightly oversized box. One difference in the contents, however, is that bean #22's Weinbrandbohne (Brandy Bean) was replaced by the Wachsbohne, or Wax Bean. This edition includes rules for up to seven players, like the Erweiterungs-Set, but also adapts the two-player rules of Al Cabohne in order to allow two people to play Bohnanza.&#10;&#10;";1997;7.06976;1.6677
12;Ra;"Ra is an auction and set-collection game with an Ancient Egyptian theme.  Each turn players are able to purchase lots of tiles with their bidding tiles (suns).  Once a player has used up his or her suns, the other players continue until they do likewise, which may set up a situation with a single uncontested player bidding on tiles before the end of the round occurs.  Tension builds because the round may end before all players have had a chance to win their three lots for the epoch.  The various tiles either give immediate points, prevent negative points for not having certain types at the end of the round (epoch), or give points after the final round.  The game lasts for three &quot;epochs&quot; (rounds).  The game is easy to learn.&#10;&#10;From the Box:&#10;The game spans 1500 years of Egyptian history in less than an hour!&#10;The players seek to expand their power and fame and there are many ways to accomplish this: Influencing Pharaohs, Building monuments, Farming on the Nile, Paying homage to the Gods, Advancing the technology and culture of the people. Ra is an auction and set collecting game where players may choose to take risks for great rewards or... And all this is for the glory of the Sun God Ra!&#10;&#10;";1999;7.66581;2.3147
13;CATAN;"In CATAN (formerly The Settlers of Catan), players try to be the dominant force on the island of Catan by building settlements, cities and roads. On each turn dice are rolled to determine which resources the island produces. Players build structures by 'spending' resources (sheep, wheat, wood, brick and ore) which are represented by the relevant resource cards; each land type, with the exception of the unproductive desert, produces a specific resource: hills produce brick, forests produce wood, mountains produce ore, fields produce wheat, and pastures produce sheep.&#10;&#10;Set-up includes randomly placing large hexagonal tiles (each depicting one of the five resource-producing terrain types--or the desert) in a honeycomb shape and surrounding them with water tiles, some of which contain ports of exchange. A number disk, the value of which will correspond to the roll of two 6-sided dice, are placed on each terrain tile. Each player is given two settlements (think: houses) and roads (sticks) which are placed on intersections and borders of the terrain tiles. Players collect a hand of resource cards based on which terrain tiles their last-placed settlement is adjacent to. A robber pawn is placed on the desert tile.&#10;&#10;A turn consists of rolling the dice, collecting resource cards based on this dice roll and the position of settlements (or upgraded cities&mdash;think: hotels), turning in resource cards (if possible and desired) for improvements, trading cards at a port, possibly playing a development card, or trading resource cards with other players. If the dice roll is a 7, the active player moves the robber to a new terrain tile and steals a resource card from another player who has a settlement adjacent to that tile.&#10;&#10;Points are accumulated by building settlements and cities, having the longest road or the largest army (from some of the development cards), and gathering certain development cards that simply award victory points. When a player has gathered 10 points (some of which may be held in secret), s/he announces this and claims the win.&#10;&#10;";1995;7.09402;2.2876
14;Basari;"Basari is a game of gem merchants competing in a marketplace&quot;: racing, collecting, trading, and predicting what the other merchants will do.&#10;&#10;To start the game, players receive 12 gemstones (3 each of 4 colors). &#10;Each turn there will be a movement phase and an action phase:&#10;&#10;For movement, everyone simultaneously rolls their die and moves their markers around a track.&#10;&#10;They then choose one of three different actions to perform. The actions are:&#10;- to take a variety of gems from a market stall, &#10;- to immediately score from between 4 and 7 points, or &#10;- to roll and move again and also collect points.&#10;&#10;The action cards are revealed simultaneously. If only 1 player chose a particular action, they simply perform that action. If 2 players chose the same action, they barter back and forth with gemstones. One player will eventually accept the other's offer of gems, and the other will take the action. If 3 or 4 players all chose the same action card, that action is cancelled. Note that in 4-player games, there will always be a conflict in choice of 3 actions, so much more negotiating goes on.&#10;&#10;A new turn begins with everyone rolling their die, moving, then choosing and revealing their action cards. When any merchant piece completes a lap around the board, the round ends and bonus points are awarded based on who has the majority in each gem color and who has completed a lap. After three rounds, the game is over and the highest score wins.&#10;&#10;Re-implemented by:&#10;&#10;&#10;     Edel, Stein & Reich&#10;&#10;&#10;";1998;6.74612;1.8478
15;Cosmic Encounter;"By request of Fantasy Flight Games, Board Game Geek lists the various editions of Cosmic Encounter in separate entries. Each edition is the same game at its core, but the features, compatible expansions, and production differ among them. This entry is for the original 1977 Eon version.&#10;&#10;Players represent alien races that are seeking to spread themselves onto five foreign worlds.  To accomplish this, they make challenges against other players and enlist the aid of interested parties.  But alien powers, which are unique to each race, give players ways to bend or outright break some rule in the game.&#10;&#10;The game continues until one player occupies five planets in other systems to win. Shared victories are possible and a player need not occupy one's own system to win.&#10;&#10;";1977;6.92506;2.3721
16;MarraCash;"Taking on the roles of shop owners in the Moroccan marketplace, players buy various shops, as color-coded tourists in the form of neat little wooden people in hats start showing up at the entry gate. Players can then move them into their own like-colored shops to earn money or move them into opponents' shops for a share of the profits. After all the tourists have been placed onto the board, the player with the biggest bankroll takes the victory. This game combines some great auction elements with spatial relationships for an appealing overall effect.&#10;&#10;Contents:&#10;  1 game board&#10;  1 blue auction stone&#10;  1 counter sheet with:&#10;      - 24 shop signs (6 each of Ali, Anfa, Omar and Leila)&#10;      -   4 player aid cards&#10;24  plastic stands&#10;54 pawns = &quot;visitors&quot; (14 yellow, 10 each of red, blue, green and purple)&#10;25 game cards with &quot;souvenirs&quot;&#10;Money in different values (500, 200, 100 and 25 Dirhams)&#10;&#10;";1996;6.97412;2.1649
17;Button Men;"This game gained a quick following after one of the major gaming conventions of 1999.  It features several characters, represented on actual stickpin buttons, that each have a unique allowance of polyhedral dice.  These dice endow each  character with fairly unique combat abilities.  Players roll the dice against each other and take their opponents' dice as casualties.  The object of the game is take out the most die 'sides' during the combat.  It's quite simple, quite inventive, and deeper than it would seem at first.&#10;&#10;";1999;6.36282;1.52
