id;name;description;year;rating;complexity
18;RoboRally;"The robots of the RoboRally automobile factory spend their weekdays toiling at the assembly line. They put in hard hours building high-speed supercars they never get to see in action. But on Saturday nights, the factory becomes a world of mad machines and dangerous schemes as these robots engage in their own epic race.It takes speed, wits, and dirty tricks to become a racing legend! Each player chooses a robot and directs its moves by playing cards. Chaos ensues as all players reveal the cards they've chosen. Players face obstacles like industrial lasers, gaping pits, and moving conveyor belts -- but those can also be used to their advantage! Each player aims to make it to each of the checkpoints in numerical order. The first player to reach all of the checkpoints wins. &#10;&#10;In RoboRally players each control a different robot in a race through a dangerous factory floor. Several goals will be placed on the board and you must navigate your robot to them in a specific order. The boards can be combined in several different ways to accommodate different player counts and races can be as long or as short as player's desire.&#10;&#10;In general, players will first fill all of their robot's &quot;registers&quot; with facedown movement cards. This happens simultaneously and there is a time element involved. If you don't act fast enough you are forced to place cards randomly to fill the rest. Then, starting with the first register, everyone reveals their card. The card with the highest number moves first. After everyone resolves their movement they reveal the next card and so on. Examples of movement cards may be to turn 90 degrees left or right, move forward 2 spaces, or move backward 1 space though there are a bigger variety than that. You can plan a perfect route, but if another robot runs into you it can push you off course. This can be disastrous since you can't reprogram any cards to fix it!&#10;&#10;Robots fire lasers and factory elements resolve after each movement and robots may become damaged. If they take enough damage certain movement cards become fixed and can no longer be changed. If they take more they may be destroyed entirely. The first robot to claim all the goals in the correct order wins, though some may award points and play tournament style.&#10;&#10;The game was reprinted by Avalon Hill (Hasbro/WotC) in 2005.&#10;&#10;UPC 742818050029&#10;&#10;";1994;7.0506;2.4285
19;Wacky Wacky West;"A long time ago, in a village far, far away, some disturbed townsfolk decided to destroy their entire town in order to rid themselves of an evil menace (it's technically a dog-mouse, but I think it's an idiomatic thing).  Anyway, so the villagers rebuilt all the buildings in the town (including their precious outhouses), but forgot to include city walls, a river, or roads.  To rectify this, players lay tiles with one of these three things onto the board, and any building caught underneath them is automatically eliminated, except for outhouses.  When an outhouse would be destroyed, players take a vote on whether to place that particular section.  Each player is trying to retain the most of one type of building, and once all the pieces have been placed the winner is the person with the highest valued buildings still standing.&#10;&#10;Wacky, Wacky West re-make description:&#10;&#10;Fans of Klaus Teuber will be interested in this remake/redesign of Drunter und Dr&uuml;ber, a 1991 Spiel des Jahres winner.&#10;&#10;&#10;Just south of nowhere, there's the junction of the Mayfair &amp; Rossdorf RR and the Turvy Trunk Line. Springing up from the desert like a tumbleweed lies the eccentric little town of Rossdorf. Like most western towns, Rossdorf has a Land Agent: Guy Dough, the brother of that wicked varmint Black Benny. A shrewd opportunist, Guy's done sold all the town land ('ceptin' the outhouses) four times over! Every acre in town that ain't got an outhouse on it is owned by the miners, the railroads, AND the fort captain. Just about a year ago, miners digging in the shadow of Fort Rossdorf struck the mother lode! But it wasn't gold, and it wasn't silver. No, my friend, it was just a little spring. Not any ordinary spring, though! It was a torrent of that mind-marbling drink the locals call &quot;Wacky Water!&quot; &#10;&#10;&#10;Now that water's done what the sun and the wind couldn't do: it's made those landholders brave enough to take matters into their own hands. Now they'll use whatever means they can to bowl over the competition and lay claim to the only fertile spots left in town! Now the only thing stoppin' 'em is the Town Charter Amendment #5, which states: &quot;no landholder may move, remove, or detonate any outhouse without a majority vote of the Town Citizens...&quot; Now one thing's for sure: something's gonna stink in Rossdorf, purty darn soon.....&#10;&#10;&#10;In Wacky Wacky West you and your fellow townfolk place track tiles, street tiles, and river tiles hoping to destroy your rivals' buildings. Every time someone tries to build over a precious outhouse, the town votes! You try to enlist your supporters (represented by cards) to vote with you to stop or encourage the play of certain tiles-perhaps saving some of your buildings or taking out those of your dastardly opponents.&#10;&#10;";1991;6.27644;1.8204
20;Full Metal Planète;"In this game of science fiction strip mining, players land on a planet and try and grab as much ore as possible and take off before the game is over.  Each player has tanks, boats, barges, mining equipment and a base ship at his disposal and will have to contend with the weather and the other miners.  The game uses an action point allowance system and thus is dice free.  Each player on his turn has a pool of points that he can divide in a variety of ways, putting all the points into one unit's movement or dividing them among several units.  Each turn is timed so players have to think quickly, and once a move has been made it cannot be retracted.  The game itself is beautifully put together, with a detailed hex grid and real metal miniatures for all of the units.&#10;&#10;Online Play: &#10;&#10;    Full Metal Galaxy&#10;    Full Metal Program&#10;    VASSAL module&#10;&#10;&#10;Re-implemented by:&#10;&#10;    Full Metal Conqu&#195;&#170;te (as a two-player version)&#10;&#10;&#10;Expanded by:&#10;&#10;    Full Metal Planete: Plateau Modulaire.&#10;&#10;&#10;Microbadges:&#10; - Full Metal Plan&egrave;te fan  Buy It&#10;&#10;";1988;7.50139;3.1429
21;Gateway to the Stars;"A 4X game (eXplore, eXpand, eXploit, eXterminate) along the lines of Stellar Conquest, players each control a space faring empire that moves out to other star systems to explore and conquer.&#10;&#10;";1994;5.58824;3.0
22;Magic Realm;"From the 2nd edition rulebook intro for MAGIC REALM:&#10;&#10;MAGIC REALM is a game of fantasy adventuring, set in a land filled with monsters, fabulous treasures, great warriors, and magicians. The scene is set in the ruins of a mighty kingdom, now inhabited by sparse groups of natives and swarms of monsters. Beneath it all are the rich remnants of a magical civilization, scattered and lost across the map.&#10;To this scene come the adventurers, seekers of riches and fame, to make a name for themselves in this promising field. Swordsman and Dwarf, Magician and Sorceror, the humans and the half-humans come seeking to loot the legendary riches of a lost civilization. Now you can play the part of one of these adventurers, stepping into an unknown Realm of magic and monsters, battles and treasures.&#10;&#10;As a player, you will take on the role of one of the sixteen major characters who are represented in detail in the game. You will control where he goes, what he tries to do, how he handles himself in combat, and much more. In the course of the game, you will run into deadly monsters, tribes of humans ranging from old friends to sworn enemies, and treasures that will enhance your abilities in many ways.&#10;&#10;MAGIC REALM is a complex game designed to recapture the suspense and desperate struggles of fantasy literature. The game creates a small but complete fantasy world, where each game is a new adventure with a new map where everything lies hidden at new locations. The game includes many more playing pieces than are actually used in a single playing. The additional pieces are set up and can appear, depending on the directions in which the characters explore, but many of the treasure troves, treasures, and spells will still be set up, unfound, when the game ends, and many of the monsters and natives might never be met. The result is an extremely unpredictable game full of surprises, a game that plays very differently each time it is played.&#10;The complete game system includes hiking, hiding and searching, fatigue, wounds, rest, trade, hiring natives, and combat between characters, monsters, and natives using a variety of weapons on horseback and afoot, as well as many magical effects.&#10;&#10;Between exploring a new land where the mountains, caves, valleys, and woods change every game, and not knowing what you will find in each place, you will find each game a new and unpredictable adventure, filled with surprises. You will find this like no other board game you have ever played.&#10;&#10;Avalon Hill Complexity rating - 9&#10;&#10;See also the list of articles about Magic Realm in The General.&#10;&#10;";1979;7.29803;4.562
23;Divine Right;"Divine Right combines combat, diplomacy, and role-playing into 2-6 hours of fast-paced action as each player attempts to build and hold together an alliance of kings long enough to defeat the other players and win the game. The kingdoms of humans, elves, goblins, dwarves and trolls are pawns in the power games that absolute monarchs play. Ambassadors vie for the attention of the kings whose favor they curry. Assassination and backstabbing are popular pastimes, and loyal allies may leave your side in the heat of battle at the drop of a hat &mdash; or a die. The magicians, too, get their arcane fingers into things, and the gods intervene as well. It is a situation that demands skill and luck.&#10;&#10;The box contains rule book, full-color mapsheet, over 250 die-cut counters, dice, and cards.&#10;&#10;&mdash;description from the publisher&#10;&#10;Expanded by:&#10;&#10;    Divine Right: Scarlet Empire&#10;&#10;&#10;";1979;7.2049;3.1688
24;Twilight Imperium;"Sprawling game of space faring races out to dominate known space.&#10;&#10;This game combines a number of elements from other game systems into a unique package. Hex tiles create the game board and each player begins with a race with unique powers. The game focuses heavily on a political voting phase and a web of trade agreements between players.&#10;&#10;&#10;Part of the Twilight Imperium Series / Family.&#10;&#10;Expanded with:&#10;&#10;    Twilight Imperium: Borderlands&#10;    Twilight Imperium: Distant Suns&#10;    Twilight Imperium: Twilight Armada&#10;    Twilight Imperium: The Outer Rim&#10;&#10;&#10;Re-implemented in:&#10;&#10;    Twilight Imperium: Second Edition&#10;    Twilight Imperium: Third Edition&#10;    Twilight Imperium (Fourth Edition)&#10;&#10;&#10;";1997;6.59282;3.4643
25;Battlemist;"In this fantasy relative to Twilight Imperium, players control races that must juggle military and economic concerns with a quest to gather the magical stars spread across the land.  The game board is made up of hex tiles and players use a resource system that has similarities to The Settlers of Catan.  A card driven system resolves players' quests.&#10;&#10;Expanded by:&#10;&#10;    Battlemist: The Sails of War&#10;&#10;&#10;Reimplemented by:&#10;&#10;    Runewars&#10;&#10;&#10;";1998;5.89138;3.2
26;Age of Renaissance;"A game that is often described as a semi-sequel to Civilization.&#10;&#10;Players attempt to build up their cultures during the Middle Ages and Renaissance periods. The game features a card deck that holds events, payout cards, and famous leaders of the particular eras. Although all cards will turn up somewhere during the game, the timing and position in which they will be played is crucial and will ensure a different game every time.&#10;&#10;The main goal of each city-state is to gain points in the form of technical advances, while keeping their culture's misery level as low as possible. The payout structure is similar to those of Civilization and Advanced Civilization in that more resources of the same type yield increasingly higher payouts. This time particular payouts are triggered by card play for every player at once. An ingenious and very smooth working &ldquo;combat&rdquo; system is implemented to determine province &ndash; and thus resource - control.&#10;&#10;";1996;7.09318;3.8495
27;Supremacy: The Game of the Superpowers;"Supremacy pits conventional superpowers against one another for control of the earth.  Along the lines of modern warfare Risk, only with an integrated supply/demand economic system.  Warfare comes in all forms from conventional, biological, chemical and all the way to nuclear.  Neat little plastic mushroom clouds are included to show where regions of the earth have been blasted, and if nuclear winter occurs, all players lose.  The game also spawned a great many supplements to expand the game further.&#10;&#10;";1984;5.68325;3.124
28;Illuminati;"In this classic Steve Jackson (I) game of world domination, each player is a secret society attempting to spread its tendrils into special interest groups throughout the world. This latest edition comes with additional cards and reworked graphics to bring the venerable game up to date.&#10;&#10;Re-issue of:&#10;&#10;    Illuminati (Small plastic box with 54 black and white cards and paper money)&#10;&#10;&#10;Expansions:&#10;&#10;    Illuminati: Y2K&#10;    Illuminati: Brainwash (re-work of Illuminati Expansion Set 3)&#10;    Illuminati: Bavarian Fire Drill&#10;    Illuminati: Mutual Assured Distraction&#10;&#10;&#10;Spin Off:&#10;&#10;    Illuminati: Crime Lords&#10;&#10;&#10;";1987;6.46611;2.6568
29;Terrain Vague;"Having many system similarities to Full Metal Plan&#195;&#168;te, Terrain Vague is a war game-ish game based on young gangs of kids fighting over turf in a junk yard. Imagine an R-rated Little Rascals movie with weapons and you get the idea.&#10;&#10;A winner of the 1992 Concours International de Cr&#195;&#169;ateurs de Jeux de Soci&#195;&#169;t&#195;&#169;.&#10;&#10;";1993;6.73533;3.25
30;Dark Tower;"An epic fantasy quest to recover an ancient magic scepter from a tyrant king in his Dark Tower, brought to life in electronic form.&#10;&#10;To vanquish the usurper, players search the four realms of the circular game board for three keys to unlock the tower's gate.  On this journey, there are battles to be fought against roving bands of brigands, dragons, plague and hunger.  There are bazaars to visit to purchase supplies and assistants for the quest.  There are uncharted territories to get lost in and tombs and ruins to plunder.  And there is a mighty army to be raised before the player can lay siege to the tower and fight either to glorious victory or crushing defeat.&#10;&#10;Dark Tower was technologically impressive when it was released in 1981.  Gameplay was facilitated by a small computer inside the black plastic shell of the tower itself.  Players input their moves on a small membrane keypad each turn and the computer took over from there, doing everything from conducting the progress of battles to keeping track of how much (or little) food was left to feed the players' always hungry warriors. The computer would play brief musical serenades at significant points of the game.&#10;&#10;";1981;6.88766;1.802
31;Dark World;"Along the lines of HeroQuest comes a much more heavily produced game called Dark World. One player is the evil lord who controls the dungeon in which the rest of the players move their characters from room to room, fighting monsters and gaining treasure. Real working treasure chests with magic weapons inside and the figures even get to put their new weapons in their character's hands.&#10;&#10;";1991;5.42229;1.8983
32;Buffalo Chess;"In Buffalo Chess, a.k.a. Bison, one player represents Indians who are trying to keep the village from being overrun by buffalo. This player moves the Indian chief and his dogs while the other player takes charge of the herd of rampaging buffalo, all of which are represented by wooden pieces. Each side has its own style of play as the pieces move differently.&#10;&#10;";1975;6.06547;1.5517
34;Arkham Horror;"Arkham Horror is a cooperative adventure game themed around H.P Lovecraft's Cthulhu Mythos.  The game has players exploring the town of Arkham as they attempt to stop unmentionable horrors from spilling into the world. It's possible for everyone to go insane and lose in this game.&#10;&#10;Re-implemented in:&#10;&#10;Arkham Horror (2005)&#10;&#10;";1987;6.67203;2.42
36;Federation & Empire;"This sprawling empire game is set in the  Star Fleet Universe. Players command one or more races in a variety of scenarios as they replay the &quot;historical&quot; situations in the galactic politics of the future.&#10;&#10;It is the base set for the Federation and Empire series of products.&#10;&#10;The Star Fleet Universe series is based on the game Star Fleet Battles, and Federation &amp; Empire is a strategic game based in that background.  Federation &amp; Empire is a stand alone game, and Star Fleet Battles is not required or needed to play this game.&#10;&#10;The two games are closely related, and Star Fleet Battles can be used to resolve some or all of the tactical battles of Federation &amp; Empire, and Federation &amp; Empire can be used as a campaign system for Star Fleet Battles.&#10;&#10;The original version came out in 1986, and was published by Task Force Games.  This was followed in 1990 with the &quot;Deluxe&quot; version, which replaced the original release.  &quot;Deluxe&quot; was indicated on the front of the box to indicate it was the new version.  The Deluxe version included a revised rule book, more counter sheets, and other player aids such as the battle board and player folio.&#10;&#10;The &quot;Deluxe&quot; version had three expansions:&#10;&#10;    Federation & Empire: Carrier War&#10;    Federation & Empire: F & E Module 1 &#226;&#128;&#147; Special Operations&#10;    Federation & Empire: F & E Module 2 &#226;&#128;&#147; Marine Assault&#10;&#10;&#10;In 2000, another revision of the rules was completed, and the F&amp;E 2K (as it is called) version stood for a decade.&#10;&#10;In 2010 the countersheets were entirely redone (with a larger number of counters per sheet) and the rulebook was once again revised to incorporate the last 10 years of errata and rulings, allowing a better integration with the expansions that were released during this period.&#10;&#10;Expanded by:&#10;&#10;&#10;    Federation & Empire: Advanced Operations&#10;    Federation & Empire: Combined Operations (combined and replaced Federation & Empire: F & E Module 1 &#226;&#128;&#147; Special Operations and Federation & Empire: F & E Module 2 &#226;&#128;&#147; Marine Assault)&#10;    Federation & Empire: Fighter Operations (replaced Federation & Empire: Carrier War)&#10;    Federation & Empire: Planetary Operations&#10;    Federation & Empire: Strategic Operations&#10;    Federation & Empire: ISC War&#10;    Federation & Empire: Minor Empires&#10;&#10;&#10;Since 2010 ADB has created, in both print and pdf form, Compendium I, II and III. The first two covered the F&amp;E sections in Captains Log&rsquo;s 21-40. All material for the base game from these is in the 2010 rule book however material for the expansions Advanced, Combined, Planetary and Strategic Operations are in the first two Compendiums&rsquo;. Compendium III has Captains Log&rsquo;s 41-50 which were all printed post 2010 rules.&#10;&#10;Fighter Operations is now updated to the 2010 standard. All relevant items from the first two Compendiums' is included.&#10;&#10;";1986;6.431;4.4032
37;Dragon Masters;"This odd little game put out by Games Workshop Ltd. uses some of the components of their Mighty Empires strategy game.  Players are competing princes in the elven homeland.  Players have to manage an economy based on villages and cities as they recruit dragons to defeat their enemies.&#10;&#10;";1991;5.8;2.0909
38;Runes;"Runes is a different kind of word game where players actually construct the letters with special game pieces.  Players attempt to figure out not simply the spelling but the actual letter structure of the hidden words.&#10;&#10;Players take turns putting one letter segment in a letter box on another player's board; they get a point if the segment belongs to that letter and the other player gets a point if it doesn't. When a player thinks they know an opponent's word they guess it and gain points equal to the number of segments in the word (or lose the points if they are incorrect).&#10;&#10;";1981;6.13689;1.9
39;Darkover;"Based on the books of Marion Zimmer Bradley this game melds your typical strategy game with what would normally be found in a party game.  Players vie for control in a world steeped in psychic energy.  Mixing strategic placement of counters with chanting and &quot;I dare you..&quot; party game mechanics makes for a truly unique game.&#10;&#10;";1979;5.36681;2.4444
40;Borderlands;"Trying to squeeze Diplomacy into a reasonable amount of time, Eon designed Borderlands to be a game where political wrangling is a must, and a free market society fuels the ambition for conquest.  Borderlands blends the conflict and deal-making elements from Diplomacy with resource management and inspired Settlers of Catan.&#10;&#10;The German edition of the game, Ascalion, contains elements from the two Borderlands expansions.&#10;&#10;Reimplemented by&#10;&#10;    Gearworld: The Borderlands&#10;&#10;&#10;";1982;6.71062;2.7917
41;Can't Stop;"In this Sid Sackson classic, players must press their luck with dice and choose combinations tactically to close out three columns. The board has one column for each possible total of two six-sided dice, but the number of spaces in each column varies: the more probable a total, the more spaces in that column and the more rolls it takes to complete. On their turn, a player rolls four dice and arranges them in duos: 1 4 5 6 can become 1+4 and 5+6 for 5 &amp; 11, 1+5 and 4+6 for 6 &amp; 10, or 1+6 and 4+5 for 7 &amp; 9. The player places or advances progress markers in the open column(s) associated with their chosen totals, then chooses whether to roll again or end their turn and replace the progress markers with markers of their color. A player can only advance three different columns in a turn and cannot advance a column which any player has closed out by reaching the end space; if a roll doesn&rsquo;t result in any legal plays, the turn ends with that turn&rsquo;s progress lost.&#10;&#10;A predecessor from 1974, The Great Races, exists as a paper-and-pencil game.&#10;&#10;";1980;6.92626;1.1442
42;Tigris & Euphrates;"Regarded by many as Reiner Knizia's masterpiece, Tigris &amp; Euphrates is set in the ancient fertile crescent with players building civilizations through tile placement. Players are given four different leaders: farming, trading, religion, and government. The leaders are used to collect victory points in these same categories. However, your score at the end of the game is the number of points in your weakest category, which encourages players not to get overly specialized. Conflict arises when civilizations connect on the board, i.e., external conflicts, with only one leader of each type surviving such a conflict. Leaders can also be replaced within a civilization through internal conflicts.&#10;&#10;Starting in the Mayfair edition from 2008, Tigris &amp; Euphrates included a double-sided game board and extra components for playing an advanced version of the game. This &quot;ziggurat expansion&quot;, initially released as a separate item in Germany for those who already owned the base game, is a special monument that extends across five spaces of the board. The monument can be built if a player has a cross of five civilization tokens of the same color by discarding those five tokens and replacing them with the ziggurat markers, placing a ziggurat tower upon the middle tile. The five ziggurat markers cannot be destroyed. All rules regarding monuments apply to the ziggurat monument as well. If your king is inside the kingdom of the ziggurat, you will get one victory point in a color of your choice at the end of your turn.&#10;&#10;Some versions of Tigris &amp; Euphrates are listed as being for 2-4 players, while others incorrectly state that they're for 3-4 players. Tigris &amp; Euphrates is part of what is sometimes called Reiner Knizia's tile-laying trilogy.&#10;&#10;";1997;7.70242;3.4957
43;Airlines;"Airlines' theme is exactly as suggested by the title. The game is similar to the Sid Sackson classic, Acquire, in that players are competing to become majority stockholders in several highly-abstracted companies with the player owning the most valuable portfolio at the end being the winner.&#10;&#10;Each turn, a player chooses from one of two actions: expand an airline and put stock into his hand, or play stock from his hand. Expanding an airline adds to its route(s) on the board and increases its value but the trick is that when a scoring card shows up (randomly), only played stock counts as a player's holdings.&#10;&#10;";1990;6.57678;2.4242
