id;name;description;year;rating;complexity
44;David & Goliath;"This game adds a very interesting twist to the standard trick-taking genre.  There are five suits and players must follow suit, if they can.  However, the winner of the trick is the highest card played, regardless of suit.  The winner gets all the cards from the trick, minus the card he won it with.  That card is given to the player that played the lowest card.  After all tricks have been played, the scoring begins.  Players score the face-value of the cards in the suits that they only collected one or two of, and one point per card for suits with more than two.  The player with the most points after a number of hands wins the game.&#10;&#10;";1997;6.49319;1.623
45;Perudo;"Liar's Dice, a.k.a. Bluff, Perudo or Dudo, is a South American dice game in which each player is given five dice and cup to roll and hide them with. Players make successively higher declarations regarding the results of all the dice remaining in the game, e.g. &quot;there are ten sixes&quot;. However, someone can always contest the bid. When that happens, all the dice are revealed and either the bidder or the caller loses dice, depending on who was correct. The last player with dice is the winner.&#10;&#10;As a public domain dice game, there are a number of variants or similar games called Liar's Dice. This includes one that is often played with Poker Dice, and differs from the marketed versions in that players only declare on their own hand's value (as opposed to all dice being in play), using poker-hand values.&#10;&#10;";1800;6.92206;1.252
46;Medici;"Another Reiner Knizia standby, this game plays very well with varying numbers of people.  The object is to accrue the most points during three rounds, which you do by spending your points to bid on sets of cards.  Each turn the current player turns up one to three cards for all the players to bid on, with the highest bid taking all cards.  The cards denote a commodity type and quantity/value.  The round ends when each player's ships are full, or the commodity card deck is exhausted.  After each round, points are awarded to each player having the most of a given commodity, and to the one with the most valuable total &quot;cargo load&quot;.&#10;&#10;Part of the Knizia auction trilogy.&#10;One of the Knizia Florentine auction games.&#10;&#10; Related Games: &#10;&#10;&#10;     Medici vs Strozzi (two-player version)&#10;     Strozzi&#10;     Mercator, included in Neue Spiele im alten Rom (ancestor to Medici).&#10;&#10;&#10;";1995;7.18278;2.2212
47;Chinatown;"This is a negotiation game in the truest sense of the word. In it, players acquire ownership of sections of city blocks then place tiles, representing businesses, onto the block-sections.  At the end of each turn, each tile you've laid gives you some sort of payout, but completed businesses (formed of three to six connected tiles of the same type) pay quite a bit better.  All these resources are dealt to the players randomly, however, so players must trade to get matching businesses and adjacent locations.&#10;&#10;This game is #2 in the Alea big box series.&#10;&#10;";1999;7.43721;2.2346
48;Krieg und Frieden;"Taking on the roles of land-owners in a feudal society, players are charged with running their lands and accruing favor from the bishop by building his cathedral.  Each turn, players use their resources to bid for that year's agenda, and some resources have more or less value in the bid depending on what type of agenda is available.  Then players use their remaining resources to build their lands, sack others' lands, bribe others' knights away from defense, or help to build the bishop's cathedral.  Finally, players harvest new resources for the next turn.  After all the pieces of the cathedral have been built, the game is over with the victory going to the player with the most victory points.  This game was originally released as Charlemagne by Think Games at Essen 1998, and later slightly shortened as Krieg und Frieden.&#10;&#10;Re-implements:&#10;&#10;    Charlemagne&#10;&#10;&#10;";1999;6.09079;2.4638
49;Mamma Mia!;"Designer Uwe Rosenberg has a talent for dreaming up new and inventive card games, and Mamma Mia! is a perfect example of this talent, with players placing pizza ingredients into a combined pool, then trying to time their pizza baking in order to make use of what's available in the kitchen.&#10;&#10;Each player starts the game with eight different pizza orders to fill, with one of those order cards in hand; each player also starts with a hand of ingredient cards (showing pepperoni, mushroom, pineapple, green pepper or olive). On a turn, a player lays down one or more ingredient cards of a single type into a common stack, then optionally adds a pizza order card to that stack. He then refills his hand by drawing as many cards as he played from either the shared ingredient deck or his own order deck.&#10;&#10;After the draw pile is exhausted, the shared pile of cards is flipped over and sorted by ingredients until an order comes up. If enough ingredient cards are available to fill that order, the owner scores it; if not, the player can make up the difference by playing cards from his hand (and thereby scoring the order) or else return the card to the bottom of his order deck.&#10;&#10;Once all the orders are scored or returned, shuffle the ingredients used in pizzas and start another round of play. After three complete rounds, the player who's filled the most orders wins!&#10;&#10;";1998;6.48076;1.362
50;Lost Cities;"Lost Cities is a card game in the Kosmos two-player series. The game originally consisted of a single deck of cards of rank 2&ndash;10 in five different colors with three special &quot;handshakes&quot; (&quot;HS&quot; in scoring examples below) in each suit, but as of 2018 the game now includes six colored suits, with the sixth color being optional for gameplay. A game board is included to organize discarded cards and help players organize their card collections.&#10;&#10;The object of the game is to gain points by mounting profitable archaeological expeditions to the different sites represented by the colored suits of cards. On a player's turn, they must first play one card, either to an expedition or by discarding it to the color-appropriate discard pile, then draw one card, either from the deck or from the top of a discard pile. Cards played to expeditions must be in ascending order, but they need not be consecutive. Handshakes are considered lower than a 2 and represent investments in an expedition. Thus, if you play a red 4, you may play any other red card higher than a 4 on a future turn but may no longer play a handshake, the 2, or the 3.&#10;&#10;The game continues in this fashion with players alternating turns until the final card is taken from the deck. The rest of the cards in hand are then discarded and players score their expeditions. Each expedition that has at least one card played into it must be scored. Cards played into an expedition are worth their rank in points, and handshakes count as a multiplier against your final total; one handshake doubles an expedition's value, while two handshakes triples that value and three handshakes quadruple it. Expeditions start at a value of -20, so you must play at least 20 points of cards into an expedition in order to make a profit. If you are left with a negative value and have a handshake, the multiplier still applies. A 20-point bonus is awarded to every expedition with at least eight cards played into it. A complete game of Lost Cities lasts three matches, with scores for each match being added together.&#10;&#10;Scoring example 1: An expedition has a 2,3,7,8,10 for a total of 30. This expedition is worth 10 total points: 30 plus the initial -20.&#10;&#10;Scoring example 2: An expedition has 2 HS, and 4,5,6,7,8,10 for a total of 40. This expedition is worth 80 total points: 40 points for cards, plus the initial -20, &times;3 for the two multipliers, plus the 20-pt bonus for playing 8+ cards.&#10;&#10;Scoring example 3: An expedition has 1 HS, and 4,6,7 for a total of 17. This expedition is worth -6 total points: 17 plus the initial -20, &times;2 for the multiplier.&#10;&#10;";1999;7.24938;1.476
51;Ricochet Robots;"Ricochet Robots is less of a game and more of a puzzle, which explains why there's such an odd number of solutions possible. There's a four-piece modular board that forms a large room with walls spread around the board. There are also color-coded targets on boards. Placed on top of the surface are four robots. The idea for each turn/puzzle is to get the like-colored robot to a randomly selected target. The trick is that once a robot starts moving, it will continue to move until a wall or another robot stops it. Therefore, players are seeking a sequence of moves for the robots that will enable them to move the required robot to the target in the fewest moves.&#10;&#10;";1999;7.03449;2.3801
52;Mighty Empires;"Mighty Empires is both a strategic layer to the Warhammer Fantasy Battle (Third Edition) system and a boardgame in its own right.  It allows players of the miniature game to manage a kingdom, explore the world, and attempt to conquer other kingdoms, but it also can be played standalone as a fantasy wargame.  The game board is constructed with hexagonal tiles to create a unique land with mountains, hills, river valleys, lowlands, and coastal areas.  The game comes with some nifty bits representing armies, castles, cities and villages.&#10;&#10;";1990;6.19015;2.6087
53;Brauerei;"Brauerei, a game about the German beer market, has players attempting to bring their beer brands to the national markets.  First though they have to master the local and regional markets, making sure everyone is supplied with beer and attempting to anticipate and evolve the public's taste in beer.&#10;&#10;";1996;6.00625;2.5
54;Tikal;"Tikal is a game of exploration within the Central American jungles in search of lost temples and the treasures within. Players send their team of explorers into the jungle, exposing more and more of the terrain.  Along the way, you find temples that require further uncovering and treasures.  Players attempt to score points for occupying temples and holding onto treasure.&#10;&#10;Tikal is the first game of the Mask Trilogy.&#10;&#10;Sequel:&#10;&#10;     Tikal II: The Lost Temple&#10;&#10;&#10;";1999;7.32061;2.7769
55;Sophie's World;"Loosely based on the book by Jostein Gaarder, Sophie's World can best be described as a specialized game of Trivial Pursuit: Genus Edition aimed at the Philosophical and Hellenistic crowd.&#10;&#10;";1998;4.84712;1.5
57;Schoko & Co.;"Schoko &amp; Co is all about producing chocolate in order to make money. Players are chocolate barons who have to contend with every element of the business from production to sales. Buy cocoa, convert it into chocolate and then sell it at sales meetings to big distributors, all along financing the staff and labor to pull it all off. Whoever is the most efficient gets the most money and the win.&#10;&#10;Ambition is the title of the French language edition by the same publisher.&#10;&#10;A winner of the 1986 Concours International de Cr&#195;&#169;ateurs de Jeux de Soci&#195;&#169;t&#195;&#169;.&#10;&#10;";1987;6.63882;2.9216
58;Kings & Things;"Kings &amp; Things is a classic Tom Wham game of warring kingdoms in a fantasy world and the legions of things that inhabit them. The board is made from hex tiles, which allows for a different board layout every time. Utilizing an interesting flipped counter element, players attempt to out bluff one another regarding the types of things they have in their armies.&#10;&#10;Reimplements:&#10;&#10;    King of the Tabletop&#10;&#10;&#10;";1986;6.51921;2.6442
59;Giganten;"Besides attempting to find oil in dusty Texas, players must also try to outbid one another for sales contracts in the oil industry.  An oilfield with drilling sites scattered about is spread out before the players, who take their trucks out trying to grab those sites as quickly as possible.&#10;&#10;Three groups of tiles are laid over the drilling sites, giving a range of value for each site once it has been reached by a player.  The deeper a site is into the field the greater its overall yield. But players have to weigh this against creating a constant supply from the smaller yields that are closer at the beginning of the game.&#10;&#10;Once oil has been produced, players can attempt to sell it on the market. But there are only three companies, and with four players this means that one player will be shut out each turn.  Bidding has an interesting element to it in that player's bidding pools are hidden from one another, making it difficult to tell whether a player is bluffing.&#10;&#10;Reimplemented as Black Gold&#10;&#10;";1999;6.69409;2.5693
61;Fossil;"On the hunt for petrified treasures, players are competing paleontologists trying to make as complete a set as possible of several fossils.  The board is laid out with a random bunch of fossil pieces and players have to take turns moving a stone about the field to a location where they want to pick up a fossil piece.  However, every movement costs them prestige points so they have to weigh carefully if the fossil is worth the effort.&#10;&#10;Won Games Magazine Game of the Year award in 1999.&#10;&#10;";1998;5.42226;1.75
63;Samurai: Game of Politics and Warfare in Feudal Japan;"(from the back of the box:)&#10;&#10;You are now back in time-12th through 17th century Japan, to be exact. Your objective: the exalted title of &quot;Shogun&quot;. As &quot;Shogun&quot;, you will have the right to enforce the emperor's will, and become the real ruler of Japan.&#10;&#10;Samurai allows you to take control of Japan. In medieval Japan, the central government of the emperor was dissolved. He become a powerless figurehead while various clans competed to take control of the country. &#10;These clans were similar to the noble houses of Europe; and their leaders the equivalent of medieval Dukes, Barons, Counts, and the like. &#10;Using formldable samurai warriors, the clans waged endless wars across the major islands of the Japanese archipelago.&#10;&#10;Concept of Play &#10;Each player controls a clan, with one or more lords. Each lord has a province representing his personal &quot;fief&quot; or home, and often has additional holdings of troops, titles, ships, castles, and more provinces.&#10;&#10;The game is played in 20 turns, each representing a pace of historical events running between a few months to a few years. In each turn, moves are conducted on a mapboard that portrays the three major islands of Japan.&#10;&#10;The playing pieces-360 in all-include Samurai Lords, clan control markers, holdings and title counters, troops, garrisons, and more; all explained in the easy&shy; to-follow prose of the 18-page rules folder.&#10;&#10;Many Games in One &#10;An excellent game for 2 to 8 players. Samurai is suitable for beginning and intermedlate play, with plenty of optional rules and strategic options for even the expert. And for the really hard-core power-politics fanatics, special rules create a nearly &quot;perpetual&quot; game representing tho true ebb and flow of Japanese feudal confilct. &#10;Samurai includes a variety of playing aids to make learning and playing the game truly an effortless task. The rules manual contains historical background and designer's notes that offer the player the full flavor and authenticity of what medieval conflict was all about in the age of the &quot;Shogun&quot; struggles.&#10;&#10;&#10;(BGG description:)&#10;&#10;Samurai is a game about warfare and politics in feudal Japan. The aim of the game is to gain the title &quot;Shogun&quot; by game end. To become Shogun, the player has to gain control of two out of four Imperial Articles scattered across the mapboard. These are: the Emperor, The Heir, The Imperial Regalia and Kyoto Castle.&#10;&#10;Playing pieces are the samurai lords of various houses. Each lord has a home province which provides him with troops. Additional troops may be added through offices, other provinces, castles, etc.&#10;&#10;";1979;6.45737;2.6296
65;The Garden Game;"Essentially an educational game for children focusing on the science and mechanics behind gardening, The Garden Game comes with a board and spinner but is basically card driven.  Players move about collecting and trading cards in order to grow plants in their garden.&#10;&#10;";1996;4.08929;1.3333
67;Conquest;"Conquest was designed to be a diceless wargame.  Its latest version updates the original with plastic units and a colorful map.  Set in ancient times, Conquest has players utilizing troops, cavalry, chariots, elephants and ships to try to capture their opponents' fortifications or occupy the &quot;quest&quot; locations.  The map is designed for point-to-point movement, and play hinges on a pool of action points that each side uses to move its different units.  Conquest comes in two versions, one designed for four players and one designed exclusively for two.&#10;&#10;";1974;6.41337;2.4706
69;Bollox;"Bollox is easy to learn as there are only two rules. Playing the game of Bollox, well, is a bit trickier.&#10;&#10;Your objective? Get five pieces in a row. Sounds easy, right?&#10;&#10;Rule One: Black plays first. Still sounds easy? Not so fast!&#10;&#10;Rule Two: The seemingly sudden 'Sandwich Move'. Just like it sounds, when you entrap two of your opponent's pieces between two of your own, you get to &quot;evict&quot; one of your opponent's pieces. This 'Sandwich Move' really does &quot;bollox up&quot; the game plan of the unwary player. Often the Sandwich Move can completely turn the game around and give you a dazzling win.&#10;&#10;1999 Mensa Select&#10;&#10;";1999;6.746;2.4
71;Civilization;"Civilization is a game of skill for 2 to 7 players. It covers the development of ancient civilizations from the invention of agriculture c. 8000 B.C. to the emergence of Rome around the middle of the third century B.C. Each player leads a nation of peoples over a map board of the Eastern Mediterranean and Near East as they attempt to carve a niche for themselves and their culture.&#10;&#10;Although battles and territorial strategy are important, this is not a war game because it is not won by battle or conquest. Instead, the object of play is to gain a level of overall advancement involving cultural, economic, and political factors so that such conflicts that do arise are a result of rivalry and land shortage rather than a desire to eliminate other players. Nomad and farmer, warrior and merchant, artisan and citizen all have an essential part to play in the development of civilization. It is the player who most effectively changes emphasis between these various outlooks who will achieve the best balance and win.&#10;&#10;(from the Introduction to the Avalon Hill edition rulebook)&#10;&#10;This game has a huge following and is widely regarded as one of the best games about ancient civilizations. Each player takes on the role of leader of an ancient civilization, such as the Illyrians or Babylonians. Your task is to guide your people through the ages by expanding your empire and using its proceeds to finance new technological advances, such as Literacy, Metalworking, or Law. The advancements help your civilization better cope with its problems as well as help bring new advancements.&#10;&#10;Civilization is widely thought to be the first game ever to incorporate a &quot;technology tree,&quot; allowing players to gain certain items and abilities only after particular other items were obtained. This influential mechanism has been adopted by countless other board games, card games, and computer games.&#10;&#10;";1980;7.49244;3.6435
73;Show Manager;"The players put together four shows in any order.  To accomplish this, players draft actor cards from a constantly changing queue of cards.  Each card represents actors of varying skills at roles.  Once a player puts together all the needed roles for a show, the value is judged against all the other productions of that type, with points given relative to the other productions.&#10;&#10;This is a Queen Games reprint of the db-Spiele original, Premiere.&#10;&#10;";1996;6.9808;2.0938
75;Falling;"This game is from an odd genre, real-time card games.  Each of the players (except the dealer) is a person falling to his death.  The goal is not to live, rather just to be the last one to go splat.  The dealer continues dealing cards to players, eventually giving them 'ground' cards.  But on the way down players can do all kinds of nasty stuff to each other to ensure their relative longevity.&#10;&#10;";1998;5.50586;1.218
77;EastFront: The War in Russia, 1941-45;"EastFront details the conflict between Germany and the Soviet Union during WWII.  Players have to contend with production, supply, command control and whether to try and break the other side's lines.  Several scenarios cover every major point of the war.  The game comes with a fantastic, detailed map of Eastern Europe and Russia printed on cardstock and many wooden blocks for the units.  This is a stand alone game that can also serve as one element of the complete EuroFront series which covers the entire European conflict of WWII.&#10;&#10;This title uses the Columbia Games Block system.  While there are variations in the rule sets, all of the &quot;Front&quot; series of games are based on the block system.  Basically this means that rather than using traditional counters to represent units on the map the game uses wooden blocks that stand upright with unit details only shown on one side.  This accomplishes two things:  First it provides an easy way of producing a &quot;fog of war&quot; because your opponent cannot tell, save through good memory or deduction, what type of unit a specific piece is or its current strength.  Second, having the blocks stand on end allows the possibility of rotating a block so the current strength is the top number.  Although most war games have some type of mechanism that allows units to take losses in steps of their overall strength, counters normally have at most two steps because they only have two sides.  Blocks, however, have four so you can easily keep track of twice the amount of detail that many other war games provide.&#10;&#10;With the use of blocks, Columbia has provided a way of adding a good deal of depth to their war games without adding complex layers of bookkeeping, allowing interesting and relatively short sessions of play.&#10;&#10;";1991;7.67256;3.6
79;MedFront: War in North Africa 1940-43;"MedFront details the conflict between the Allies and Germany during WWII from 1940-43, as well as the Spanish Civil War from 1936-39. Players have to contend with production, supply, command control and the weather to break the other side's lines and achieve victory.  The game comes with a fantastic detailed map of Spain and North Africa printed on card and many wooden blocks for the units. This is just one portion of the complete EuroFront series, which covers the entire European conflict of WWII.&#10;&#10;This title uses Columbia Games Block system.  While there are variations in the rule sets, all of their games are based on the block system.  Basically this means that rather than using the traditional  counters to represent units on the map the game uses wooden blocks that stand upright with unit details only shown on one side.  This does two things:  First it provides an easy way of producing a &quot;fog of war&quot; because your opponent can not tell, save through good memory, what type of unit a specific piece is or its current strength.  Second, having the blocks stand on end allows the possibility of rotating a block so the current strength is the top number.  Although most war games have some type of mechanism that lets units take steps in their overall strength, counters normally have at most two steps because they only have two sides.  Blocks, however, have four so you can easily keep track of twice the amount of detail that many other war games provide.  With the use of blocks Columbia has provided a way of adding a good deal of depth to their war games without adding complex layers of bookkeeping, allowing interesting and relatively short sessions of play.&#10;&#10;WestFront II: The War in Europe 1943-45 &#226;&#128;&#147; Second Edition includes updated MedFront maps and some Spanish units; EuroFront: The War in Europe, 1936-45 &#226;&#128;&#147; Second Edition has the updated MedFront rules (and the Spanish Civil War scenario and other Spanish units) for those maps.&#10;&#10;Expanded by:&#10;&#10;    EuroFront: War in Europe, 1939-45&#10;&#10;&#10;";1994;6.3375;3.0769
